1,4073,4002,f,9,,9,1,en,Housing subsidy in Barking and Dagenham,,"<strong>Summary Agenda</strong><br><br>9.30 am<br>&nbsp;&nbsp;&nbsp; <br>Prayers.<br>Afterwards<br>&nbsp;&nbsp;&nbsp; <br>Private Members’ Bills: Second Readings.<br>&nbsp; &nbsp;&nbsp;&nbsp; <br>(Note: If proceedings on the first Bill end before 2.30 pm, the fifth Bill and, possibly, subsequent Bills may be debated in the time remaining. After 2.30 pm, only those Bills which are unopposed may make further progress.)<br>At the end of the sitting<br>&nbsp;&nbsp;&nbsp; <br>Adjournment : Housing subsidy in Barking and Dagenham (Jon Cruddas) (until 3.00 pm or for half an hour, whichever is later).",2009-10-07,archived,,t,agendaitem
2,4069,4005,f,9,,9,1,en,Asbestos in homes,,"<strong>Summary Agenda</strong><br><br>2.30 pm<br>&nbsp;&nbsp;&nbsp; <br>Prayers.<br>Afterwards<br>&nbsp;&nbsp;&nbsp; <br>Oral Questions to the Secretary of State for Work and Pensions, including at 3.15 pm Topical Questions.<br>3.30 pm<br>&nbsp;&nbsp;&nbsp; <br>Urgent Questions, Ministerial Statements, including on Building Britain’s Future.<br>Afterwards<br>&nbsp;&nbsp;&nbsp; <br>Parliamentary Standards Bill: Second Reading (may continue until 10.00 pm).<br>&nbsp; &nbsp;&nbsp;&nbsp; <br>—followed by Programme Motion (without separate debate).<br>&nbsp; &nbsp;&nbsp;&nbsp; <br>—followed by Money Resolution (without separate debate).<br>&nbsp; &nbsp;&nbsp;&nbsp; <br>Statutory Instruments (Motions for approval) (without debate).<br>&nbsp; &nbsp;&nbsp;&nbsp; <br>Legislative Reform Order (Motion for approval) (without debate).<br>&nbsp; &nbsp;&nbsp;&nbsp; <br>Motions to change the membership of Select Committees: Children, Schools and Families; Regulatory Reform; Work and Pensions (no debate after 10.00 pm).<br>At the end of the sitting<br>&nbsp;&nbsp;&nbsp; <br>Adjournment Debate: Asbestos in homes (Mr Michael Clapham) (until 10.30 pm or for half an hour, whichever is later).",2009-10-07,archived,,t,agendaitem
3,4072,4008,f,9,,9,1,en,Future of public houses,,"<strong>Summary Agenda</strong><br><br>10.30 am<br>&nbsp;&nbsp;&nbsp; <br>Prayers.<br>Afterwards<br>&nbsp;&nbsp;&nbsp; <br>Private Business (without debate).<br>&nbsp; &nbsp;&nbsp;&nbsp; <br>Oral Questions to Mr Chancellor of the Exchequer, including at 11.15 am Topical Questions.<br>11.30 am<br>&nbsp;&nbsp;&nbsp; <br>Urgent Questions (if any); Business Question to<br>the Leader of the House; Ministerial Statements<br>(if any).<br>Afterwards<br>&nbsp;&nbsp;&nbsp; <br>Defence in the UK (Motion) (may continue until 6.00 pm).<br>At the end of the sitting<br>&nbsp;&nbsp;&nbsp; <br>Adjournment Debate: Future of public houses<br>(Mr Laurence Robertson) (until 6.30 pm or for half an hour, whichever is later).",2009-10-07,archived,,t,agendaitem
7,4072,4020,f,9,,9,1,en,Future of public houses,,"<strong>Summary Agenda</strong><br><br>10.30 am<br>&nbsp;&nbsp;&nbsp; <br>Prayers.<br>Afterwards<br>&nbsp;&nbsp;&nbsp; <br>Private Business (without debate).<br>&nbsp; &nbsp;&nbsp;&nbsp; <br>Oral Questions to Mr Chancellor of the Exchequer, including at 11.15 am Topical Questions.<br>11.30 am<br>&nbsp;&nbsp;&nbsp; <br>Urgent Questions (if any); Business Question to<br>the Leader of the House; Ministerial Statements<br>(if any).<br>Afterwards<br>&nbsp;&nbsp;&nbsp; <br>Defence in the UK (Motion) (may continue until 6.00 pm).<br>At the end of the sitting<br>&nbsp;&nbsp;&nbsp; <br>Adjournment Debate: Future of public houses<br>(Mr Laurence Robertson) (until 6.30 pm or for half an hour, whichever is later).",2009-10-07,archived,,t,agendaitem
9,4072,4026,f,9,,9,1,en,Future of public houses,,"<strong>Summary Agenda</strong><br><br>10.30 am<br>&nbsp;&nbsp;&nbsp; <br>Prayers.<br>Afterwards<br>&nbsp;&nbsp;&nbsp; <br>Private Business (without debate).<br>&nbsp; &nbsp;&nbsp;&nbsp; <br>Oral Questions to Mr Chancellor of the Exchequer, including at 11.15 am Topical Questions.<br>11.30 am<br>&nbsp;&nbsp;&nbsp; <br>Urgent Questions (if any); Business Question to<br>the Leader of the House; Ministerial Statements<br>(if any).<br>Afterwards<br>&nbsp;&nbsp;&nbsp; <br>Defence in the UK (Motion) (may continue until 6.00 pm).<br>At the end of the sitting<br>&nbsp;&nbsp;&nbsp; <br>Adjournment Debate: Future of public houses<br>(Mr Laurence Robertson) (until 6.30 pm or for half an hour, whichever is later).",2009-10-07,archived,,t,agendaitem
4,4067,4011,f,9,,9,1,en,Preservation of traditional crafts,,"<strong>Summary Agenda</strong><br><br>10.30 am<br>&nbsp;&nbsp;&nbsp; <br>Prayers.<br>Afterwards<br>&nbsp;&nbsp;&nbsp; <br>Oral Questions to the Minister of State for Transport, including at 11.05 am Topical Questions.<br>11.15 am<br>&nbsp;&nbsp;&nbsp; <br>Oral Questions to the Minister for Women and Equality.<br>11.30 am<br>&nbsp;&nbsp;&nbsp; <br>Urgent Questions (if any); Business Question to the Leader of the House; Ministerial Statements (if any).<br>Afterwards<br>&nbsp;&nbsp;&nbsp; <br>Presentation of Bill (without debate).<br>&nbsp; &nbsp;&nbsp;&nbsp; <br>Business of the House (Motion) (may continue until 6.00 pm).<br>&nbsp; &nbsp;&nbsp;&nbsp; <br>Regional Select Committee (London) (Motion) (may continue for up to one hour, if the Business of the House Motion is agreed to).<br>&nbsp; &nbsp;&nbsp;&nbsp; <br>Standing Orders Etc. (Machinery of Government Changes); Parliamentary Pensions (Motions) (may continue until 5.00 pm, if the Business of the House Motion is agreed to).<br>&nbsp; &nbsp;&nbsp;&nbsp; <br>Regional Grand Committees (Motions) (without debate).<br>At the end of the sitting<br>&nbsp;&nbsp;&nbsp; <br>Adjournment Debate: Preservation of traditional crafts (Tom Levitt) (until 6.30 pm or for half an hour, whichever is later).",2009-10-07,archived,,t,agendaitem
5,4076,4014,f,9,,9,417,en,Consultations on Post Office closures,,"<strong>Summary Agenda</strong><br><br>2.30 pm<br>&nbsp;&nbsp;&nbsp; <br>Prayers.<br>Afterwards<br>&nbsp;&nbsp;&nbsp; <br>Urgent Questions, Ministerial Statements (if any).<br>&nbsp; &nbsp;&nbsp;&nbsp; <br>Business of the House (Motion) (may continue until 10.00 pm).<br>&nbsp; &nbsp;&nbsp;&nbsp; <br>Speaker’s Committee on the Search of Offices on the Parliamentary Estate (Motion) (may continue for three hours after the commencement of proceedings on the Business of the House Motion, if that Motion is agreed to).<br>&nbsp; &nbsp;&nbsp;&nbsp; <br>Queen’s Speech (Motion for an Address) (proposed subjects for debate: Employment, Universities and Skills and Housing) (may continue until 11.00 pm, if the 10.00 pm Business Motion is agreed to).<br>&nbsp; &nbsp;&nbsp;&nbsp; <br>Estimates (Motion) (without debate).<br>At the end of the sitting<br>&nbsp;&nbsp;&nbsp; <br>Adjournment Debate: Consultations on Post Office closures (Dr Richard Taylor) (until 10.30 pm or for half an hour, whichever is later).&nbsp;",2009-10-07,archived,,t,agendaitem
6,4078,4017,f,9,,9,417,en,Risk management strategy,,"<strong>Summary Agenda</strong><br><br>11.30 am<br>&nbsp;&nbsp;&nbsp; <br>Prayers.<br>Afterwards<br>&nbsp;&nbsp;&nbsp; <br>Oral Questions to the Secretary of State for Scotland.<br>12 noon<br>&nbsp;&nbsp;&nbsp; <br>Oral Questions to the Prime Minister.<br>12.30 pm<br>&nbsp;&nbsp;&nbsp; <br>Urgent Questions, Ministerial Statements (if any).<br>Afterwards<br>&nbsp;&nbsp;&nbsp; <br>Queen’s Speech (Motion for an Address) (proposed subjects for debate: Foreign Affairs and Defence) (may continue until 7.00 pm).<br>&nbsp; &nbsp;&nbsp;&nbsp; <br>Business of the House (Consolidated Fund Bill) (Motion) (no debate after 7.00 pm).<br>At the end of the sitting<br>&nbsp;&nbsp;&nbsp; <br>Adjournment Debate: River Hull and River Humber flood risk management strategy (Mr Graham Stuart) (until 7.30 pm or for half an hour, whichever is later).",2009-10-07,archived,,t,agendaitem
8,4069,4023,f,9,,9,1,en,Asbestos in homes,,"<strong>Summary Agenda</strong><br><br>2.30 pm<br>&nbsp;&nbsp;&nbsp; <br>Prayers.<br>Afterwards<br>&nbsp;&nbsp;&nbsp; <br>Oral Questions to the Secretary of State for Work and Pensions, including at 3.15 pm Topical Questions.<br>3.30 pm<br>&nbsp;&nbsp;&nbsp; <br>Urgent Questions, Ministerial Statements, including on Building Britain’s Future.<br>Afterwards<br>&nbsp;&nbsp;&nbsp; <br>Parliamentary Standards Bill: Second Reading (may continue until 10.00 pm).<br>&nbsp; &nbsp;&nbsp;&nbsp; <br>—followed by Programme Motion (without separate debate).<br>&nbsp; &nbsp;&nbsp;&nbsp; <br>—followed by Money Resolution (without separate debate).<br>&nbsp; &nbsp;&nbsp;&nbsp; <br>Statutory Instruments (Motions for approval) (without debate).<br>&nbsp; &nbsp;&nbsp;&nbsp; <br>Legislative Reform Order (Motion for approval) (without debate).<br>&nbsp; &nbsp;&nbsp;&nbsp; <br>Motions to change the membership of Select Committees: Children, Schools and Families; Regulatory Reform; Work and Pensions (no debate after 10.00 pm).<br>At the end of the sitting<br>&nbsp;&nbsp;&nbsp; <br>Adjournment Debate: Asbestos in homes (Mr Michael Clapham) (until 10.30 pm or for half an hour, whichever is later).",2009-10-07,archived,,t,agendaitem
